{
  "lessonId": "dsa5105-pca-numerical",
  "schemaVersion": "nus.study-kit.v1",
  "flashcards": [
    {
      "front": "Define PCA computation.",
      "back": "State the object, the input assumptions, and the quantity it computes."
    },
    {
      "front": "What is the main failure mode for PCA computation?",
      "back": "Name the assumption that breaks and one diagnostic or mitigation."
    },
    {
      "front": "How would you test PCA computation?",
      "back": "Use a small hand-worked example before scaling the experiment."
    }
  ],
  "homework": [
    {
      "prompt": "Write a 5-line explanation of PCA computation using one example.",
      "rubric": "Definition, assumptions, worked example, and one limitation.",
      "source": {
        "sourceId": "DSA5105/Textbook.pdf",
        "page": 86,
        "sourceType": "textbook",
        "role": "PCA computation",
        "status": "course-depth"
      }
    },
    {
      "prompt": "Create one edge case that could fool a superficial implementation of PCA computation.",
      "rubric": "The edge case should be concrete and explain why it matters.",
      "source": {
        "sourceId": "DSA5105/Textbook.pdf",
        "page": 86,
        "sourceType": "textbook",
        "role": "PCA computation",
        "status": "course-depth"
      }
    }
  ],
  "codeExercises": []
}
