{
  "lessonId": "dsa5101-orientation",
  "schemaVersion": "nus.study-kit.v1",
  "flashcards": [
    {
      "front": "Define big-data workflow.",
      "back": "State the object, the input assumptions, and the quantity it computes."
    },
    {
      "front": "What is the main failure mode for big-data workflow?",
      "back": "Name the assumption that breaks and one diagnostic or mitigation."
    },
    {
      "front": "How would you test big-data workflow?",
      "back": "Use a small hand-worked example before scaling the experiment."
    }
  ],
  "homework": [
    {
      "prompt": "Write a 5-line explanation of big-data workflow using one example.",
      "rubric": "Definition, assumptions, worked example, and one limitation.",
      "source": {
        "sourceId": "DSA5101/DSA5101 Course Information.pdf",
        "page": 1
      }
    },
    {
      "prompt": "Create one edge case that could fool a superficial implementation of big-data workflow.",
      "rubric": "The edge case should be concrete and explain why it matters.",
      "source": {
        "sourceId": "DSA5101/DSA5101 Course Information.pdf",
        "page": 1
      }
    }
  ],
  "codeExercises": []
}
