{
  "lessonId": "dsa5105-mdp-value-iteration",
  "schemaVersion": "nus.study-kit.v1",
  "flashcards": [
    {
      "front": "Define value iteration.",
      "back": "State the object, the input assumptions, and the quantity it computes."
    },
    {
      "front": "What is the main failure mode for value iteration?",
      "back": "Name the assumption that breaks and one diagnostic or mitigation."
    },
    {
      "front": "How would you test value iteration?",
      "back": "Use a small hand-worked example before scaling the experiment."
    }
  ],
  "homework": [
    {
      "prompt": "Write a 5-line explanation of value iteration using one example.",
      "rubric": "Definition, assumptions, worked example, and one limitation.",
      "source": {
        "sourceId": "DSA5105/Textbook.pdf",
        "page": 115,
        "sourceType": "textbook",
        "role": "value iteration",
        "status": "course-depth"
      }
    },
    {
      "prompt": "Create one edge case that could fool a superficial implementation of value iteration.",
      "rubric": "The edge case should be concrete and explain why it matters.",
      "source": {
        "sourceId": "DSA5105/Textbook.pdf",
        "page": 115,
        "sourceType": "textbook",
        "role": "value iteration",
        "status": "course-depth"
      }
    }
  ],
  "codeExercises": []
}
