{
  "lessonId": "dsa5104-sql-aggregation",
  "schemaVersion": "nus.study-kit.v1",
  "flashcards": [
    {
      "front": "Ch3.5 · Aggregation, GROUP BY, HAVING, and BIG 6",
      "back": "Evaluate aggregate queries in logical order and keep row predicates separate from group predicates."
    },
    {
      "front": "Source boundary?",
      "back": "Lecture slides define current scope; homework and textbook pointers add practice depth."
    },
    {
      "front": "First safety check?",
      "back": "Group by the attributes that identify a group"
    }
  ],
  "homework": [
    {
      "prompt": "Explain the main move in Ch3.5 · Aggregation, GROUP BY, HAVING, and BIG 6 and cite the source page.",
      "rubric": "State the semantic operation, source boundary, and one edge case.",
      "sourceRefs": [
        {
          "sourceId": "DSA5104/chapter3.pdf",
          "page": 50,
          "sourceType": "lecture",
          "role": "Ch3.5 · Aggregation, GROUP BY, HAVING, and BIG 6",
          "status": "current"
        }
      ]
    },
    {
      "prompt": "Create one counterexample or test case for Ch3.5 · Aggregation, GROUP BY, HAVING, and BIG 6.",
      "rubric": "Show the input, expected behavior, and the trap it catches.",
      "sourceRefs": [
        {
          "sourceId": "DSA5104/chapter3.pdf",
          "page": 50,
          "sourceType": "lecture",
          "role": "Ch3.5 · Aggregation, GROUP BY, HAVING, and BIG 6",
          "status": "current"
        }
      ]
    }
  ],
  "codeExercises": []
}
