{
  "lessonId": "dsa5101-minhash-lsh",
  "schemaVersion": "nus.study-kit.v1",
  "flashcards": [
    {
      "front": "Define MinHash and LSH.",
      "back": "State the object, the input assumptions, and the quantity it computes."
    },
    {
      "front": "What is the main failure mode for MinHash and LSH?",
      "back": "Name the assumption that breaks and one diagnostic or mitigation."
    },
    {
      "front": "How would you test MinHash and LSH?",
      "back": "Use a small hand-worked example before scaling the experiment."
    }
  ],
  "homework": [
    {
      "prompt": "Write a 5-line explanation of MinHash and LSH using one example.",
      "rubric": "Definition, assumptions, worked example, and one limitation.",
      "source": {
        "sourceId": "DSA5101/Assignments/DSA5101_Assignment_1.pdf",
        "page": 3
      }
    },
    {
      "prompt": "Create one edge case that could fool a superficial implementation of MinHash and LSH.",
      "rubric": "The edge case should be concrete and explain why it matters.",
      "source": {
        "sourceId": "DSA5101/Assignments/DSA5101_Assignment_1.pdf",
        "page": 3
      }
    }
  ],
  "codeExercises": []
}
