{
  "lessonId": "dsa5104-ch5-preview",
  "schemaVersion": "nus.study-kit.v1",
  "flashcards": [
    {
      "front": "Ch5 · Advanced SQL exercise preview",
      "back": "This preview organizes the supplied Chapter 5 homework solutions around programming-language access, triggers, recursive queries, and advanced aggregation. The future DSA5104 lecture emphasis is not yet verified locally."
    },
    {
      "front": "Current scope?",
      "back": "Exercise-only preview; official lecture source pending."
    },
    {
      "front": "Exam default?",
      "back": "The lesson container stays excluded until a current lecture source is verified; explicitly promoted bank questions are the only exception."
    }
  ],
  "homework": [
    {
      "prompt": "Attempt the complete advanced SQL solution set before reading the answers.",
      "rubric": "Tag each item by skill and record unresolved assumptions.",
      "sourceRefs": [
        {
          "sourceId": "DSA5104/Homework Solutions/Ch05_Advanced_SQL/1.md",
          "page": 1,
          "sourceType": "exercise",
          "role": "advanced SQL exercise set",
          "status": "current-context"
        }
      ]
    },
    {
      "prompt": "Write one question that the future official lecture deck must answer.",
      "rubric": "Name the missing source evidence and the technical ambiguity.",
      "sourceRefs": [
        {
          "sourceId": "DSA5104/Homework Solutions/Ch05_Advanced_SQL/1.md",
          "page": 1,
          "sourceType": "exercise",
          "role": "advanced SQL exercise set",
          "status": "current-context"
        }
      ]
    }
  ],
  "codeExercises": []
}
