{
  "lessonId": "dsa5104-sql-foundations",
  "schemaVersion": "nus.study-kit.v1",
  "flashcards": [
    {
      "front": "WHERE or HAVING?",
      "back": "WHERE filters rows before grouping; HAVING filters groups after aggregation."
    },
    {
      "front": "Declarative SQL?",
      "back": "The query states the desired relation result; the engine chooses how to evaluate it."
    },
    {
      "front": "What is the join invariant?",
      "back": "The join predicate connects identities through keys, not through incidental row order."
    }
  ],
  "homework": [
    {
      "prompt": "Write and explain a query that lists departments with at least two students.",
      "rubric": "Use a key-based join, GROUP BY department identity, COUNT(*), and HAVING.",
      "source": {
        "sourceId": "DSA5104/Homework Solutions/Ch03_Introduction_to_SQL/3.2.md",
        "page": 1,
        "sourceType": "exercise",
        "role": "aggregate query",
        "status": "current-context"
      }
    },
    {
      "prompt": "Give a NULL edge case that changes the result of a comparison or aggregate.",
      "rubric": "State that NULL is unknown, then explain the affected predicate or aggregate behavior.",
      "source": {
        "sourceId": "DSA5104/chapter1.pdf",
        "page": 30,
        "sourceType": "lecture",
        "role": "SQL query language",
        "status": "current"
      }
    }
  ],
  "codeExercises": [
    {
      "id": "dsa5104-sql-code",
      "language": "sql",
      "prompt": "Return departments with at least two students.",
      "starter": "SELECT d.name, COUNT(*) AS n\nFROM Department d JOIN Student s ON s.department_id = d.id\nGROUP BY d.id, d.name\nHAVING COUNT(*) >= 2;",
      "expected": "Data Science|2",
      "solution": "The aggregate filter belongs in HAVING, not WHERE."
    }
  ]
}
