{
  "lessonId": "dsa5104-database-design",
  "schemaVersion": "nus.study-kit.v1",
  "flashcards": [
    {
      "front": "Logical versus physical design?",
      "back": "Logical design chooses relation schemas and constraints; physical design chooses storage layout and access methods."
    },
    {
      "front": "Many-to-many mapping?",
      "back": "Create a relationship relation with both entity keys, relationship attributes, and foreign-key constraints."
    },
    {
      "front": "Why use a composite key?",
      "back": "It can enforce that one pair of participating entities appears at most once."
    }
  ],
  "homework": [
    {
      "prompt": "$Design a many-to-many schema for Student and Club with membership_since as a relationship attribute.$",
      "rubric": "Create Student, Club, and Membership relations; include both foreign keys and a composite identity.",
      "source": {
        "sourceId": "DSA5104/Homework Solutions/Ch06_Database_Design_Using_the_ER_Model/6.23.md",
        "page": 1,
        "sourceType": "exercise",
        "role": "many-to-many design",
        "status": "current-context"
      }
    },
    {
      "prompt": "Explain one benefit and one cost of three-tier architecture for a database application.",
      "rubric": "Mention separation/security/scalability and the added application-server boundary.",
      "source": {
        "sourceId": "DSA5104/chapter1.pdf",
        "page": 44,
        "sourceType": "lecture",
        "role": "application architecture",
        "status": "current"
      }
    }
  ],
  "codeExercises": []
}
