{
  "lessonId": "dsa5105-week1-derivations",
  "schemaVersion": "nus.study-kit.v1",
  "flashcards": [
    {
      "front": "Empirical versus population risk?",
      "back": "Empirical risk averages loss on observed examples; population risk averages over future draws.",
      "source": {
        "sourceId": "DSA5105/Lec1_annotated.pdf",
        "page": 23,
        "sourceType": "lecture",
        "role": "population risk",
        "status": "current"
      }
    },
    {
      "front": "Why is Huber influence bounded?",
      "back": "Its derivative is linear inside the threshold and capped at plus or minus $\\delta$ outside, so an extreme residual cannot dominate the stationarity equation.",
      "source": {
        "sourceId": "DSA5105/Lec1_annotated.pdf",
        "page": 35,
        "sourceType": "lecture",
        "role": "Huber influence",
        "status": "current"
      }
    },
    {
      "front": "What does the ridge spectral filter do?",
      "back": "In an eigen-direction with eigenvalue $\\mu$, the coefficient is multiplied by $\\mu$ divided by $\\mu$ plus $\\lambda$; weak directions shrink most.",
      "source": {
        "sourceId": "DSA5105/Lec1_annotated.pdf",
        "page": 48,
        "sourceType": "lecture",
        "role": "ridge spectrum",
        "status": "current"
      }
    },
    {
      "front": "Why is binary logistic loss convex in the score?",
      "back": "Its second derivative is non-negative everywhere, so the score-level objective is convex.",
      "source": {
        "sourceId": "DSA5105/Lec1_annotated.pdf",
        "page": 54,
        "sourceType": "lecture",
        "role": "logistic convexity",
        "status": "current"
      }
    }
  ],
  "homework": [
    {
      "prompt": "Derive the stationarity equation for Huber location and explain why an extreme residual cannot dominate it.",
      "rubric": "Differentiate the two regions, write the sum of $\\psi$ terms as zero, and connect the capped derivative to bounded influence.",
      "source": {
        "sourceId": "DSA5105/Lec1_annotated.pdf",
        "page": 35,
        "sourceType": "lecture",
        "role": "Huber derivation",
        "status": "current"
      }
    },
    {
      "prompt": "Show the null-space family of singular least-squares solutions and compare it with ridge in the eigenbasis.",
      "rubric": "Use the pseudoinverse plus a null-space component, then derive the $\\mu$ divided by $\\mu$ plus $\\lambda$ shrinkage factor and interpret weak directions.",
      "source": {
        "sourceId": "DSA5105/Lec1_exercises-solutions.pdf",
        "page": 2,
        "sourceType": "lecture",
        "role": "official exercise alignment",
        "status": "current"
      }
    }
  ],
  "codeExercises": []
}
