{
  "lessonId": "dsa5104-sql-cte",
  "schemaVersion": "nus.study-kit.v1",
  "flashcards": [
    {
      "front": "Ch3.7 · Common table expressions",
      "back": "Name a statement-scoped intermediate result and compose readable multi-step queries."
    },
    {
      "front": "Source boundary?",
      "back": "Lecture slides define current scope; homework and textbook pointers add practice depth."
    },
    {
      "front": "First safety check?",
      "back": "Explain the scope of a CTE"
    }
  ],
  "homework": [
    {
      "prompt": "Explain the main move in Ch3.7 · Common table expressions and cite the source page.",
      "rubric": "State the semantic operation, source boundary, and one edge case.",
      "sourceRefs": [
        {
          "sourceId": "DSA5104/chapter3.pdf",
          "page": 79,
          "sourceType": "lecture",
          "role": "Ch3.7 · Common table expressions",
          "status": "current"
        }
      ]
    },
    {
      "prompt": "Create one counterexample or test case for Ch3.7 · Common table expressions.",
      "rubric": "Show the input, expected behavior, and the trap it catches.",
      "sourceRefs": [
        {
          "sourceId": "DSA5104/chapter3.pdf",
          "page": 79,
          "sourceType": "lecture",
          "role": "Ch3.7 · Common table expressions",
          "status": "current"
        }
      ]
    }
  ],
  "codeExercises": []
}
