{
  "lessonId": "dsa5105-erm",
  "schemaVersion": "nus.study-kit.v1",
  "flashcards": [
    {
      "front": "Training set versus oracle?",
      "back": "The training set contains observed (x, y) pairs; the oracle is the unknown relationship that generated or explains the targets."
    },
    {
      "front": "Deterministic oracle?",
      "back": "Each input maps to one target through y = f*(x)."
    },
    {
      "front": "Random oracle?",
      "back": "The target is sampled from a conditional distribution p*(y | x), or represented as a target function plus noise."
    },
    {
      "front": "What does N mean?",
      "back": "The number of observed training examples in the dataset."
    }
  ],
  "homework": [
    {
      "prompt": "Explain the difference between an observed label and the oracle that generated it.",
      "rubric": "Name the observed pair, the unknown relationship, and the deterministic versus random cases.",
      "source": {
        "sourceId": "DSA5105/Ref/week1_DSA5105_lecture1_with_note.pdf",
        "page": 26,
        "sourceType": "lecture",
        "role": "training set and oracle",
        "status": "current"
      }
    },
    {
      "prompt": "Give one classification example and one regression example of a random oracle.",
      "rubric": "Use conditional label uncertainty for classification and additive noise for regression.",
      "source": {
        "sourceId": "DSA5105/Ref/week1_DSA5105_lecture1_with_note.pdf",
        "page": 26,
        "sourceType": "lecture",
        "role": "random oracle",
        "status": "current"
      }
    }
  ],
  "codeExercises": []
}
