{
  "lessonId": "dsa5105-spectral-clustering",
  "schemaVersion": "nus.study-kit.v1",
  "flashcards": [
    {
      "front": "Define spectral clustering.",
      "back": "State the object, the input assumptions, and the quantity it computes."
    },
    {
      "front": "What is the main failure mode for spectral clustering?",
      "back": "Name the assumption that breaks and one diagnostic or mitigation."
    },
    {
      "front": "How would you test spectral clustering?",
      "back": "Use a small hand-worked example before scaling the experiment."
    }
  ],
  "homework": [
    {
      "prompt": "Write a 5-line explanation of spectral clustering using one example.",
      "rubric": "Definition, assumptions, worked example, and one limitation.",
      "source": {
        "sourceId": "DSA5105/Ref/Mathematics_of_Data_Science.pdf",
        "page": 53,
        "sourceType": "ref",
        "role": "spectral clustering",
        "status": "draft"
      }
    },
    {
      "prompt": "Create one edge case that could fool a superficial implementation of spectral clustering.",
      "rubric": "The edge case should be concrete and explain why it matters.",
      "source": {
        "sourceId": "DSA5105/Ref/Mathematics_of_Data_Science.pdf",
        "page": 53,
        "sourceType": "ref",
        "role": "spectral clustering",
        "status": "draft"
      }
    }
  ],
  "codeExercises": []
}
