{
  "lessonId": "dsa5104-ch7-preview",
  "schemaVersion": "nus.study-kit.v1",
  "flashcards": [
    {
      "front": "Ch7 · Schema refinement exercise preview",
      "back": "This preview organizes the supplied Chapter 7 homework solutions around functional dependencies, closure, BCNF, lossless decomposition, and dependency preservation. It is exercise-only until the official DSA5104 second-half lecture source is supplied."
    },
    {
      "front": "Current scope?",
      "back": "Exercise-only preview; official lecture source pending."
    },
    {
      "front": "Exam default?",
      "back": "The lesson container stays excluded until a current lecture source is verified; explicitly promoted bank questions are the only exception."
    }
  ],
  "homework": [
    {
      "prompt": "Attempt the complete schema refinement solution set before reading the answers.",
      "rubric": "Tag each item by skill and record unresolved assumptions.",
      "sourceRefs": [
        {
          "sourceId": "DSA5104/Homework Solutions/Ch07_Relational_Database_Design/1.md",
          "page": 1,
          "sourceType": "exercise",
          "role": "schema refinement exercise set",
          "status": "current-context"
        }
      ]
    },
    {
      "prompt": "Write one question that the future official lecture deck must answer.",
      "rubric": "Name the missing source evidence and the technical ambiguity.",
      "sourceRefs": [
        {
          "sourceId": "DSA5104/Homework Solutions/Ch07_Relational_Database_Design/1.md",
          "page": 1,
          "sourceType": "exercise",
          "role": "schema refinement exercise set",
          "status": "current-context"
        }
      ]
    }
  ],
  "codeExercises": []
}
