{
  "lessonId": "dsa5101-balance",
  "schemaVersion": "nus.study-kit.v1",
  "flashcards": [
    {
      "front": "Define the balance object.",
      "back": "State the input representation, target quantity, update rule, and the main assumption."
    },
    {
      "front": "What is the balance failure mode?",
      "back": "Name the assumption or boundary case that can break a superficial solution."
    },
    {
      "front": "How do you audit a balance calculation?",
      "back": "Write the state, apply one update at a time, and check the output against the invariant."
    }
  ],
  "homework": [
    {
      "prompt": "Write a worked balance example with one adversarial edge case.",
      "rubric": "Correct setup, explicit intermediate state, final answer, and one limitation.",
      "source": {
        "sourceId": "DSA5101/Assignments/DSA5101_Assignment_2.pdf",
        "page": 7,
        "sourceType": "exercise",
        "role": "BALANCE sequences",
        "status": "current-context"
      }
    },
    {
      "prompt": "Explain when balance is the wrong abstraction for a production decision.",
      "rubric": "Names a mismatch between representation, objective, scale, or error contract.",
      "source": {
        "sourceId": "DSA5101/Assignments/DSA5101_Assignment_2.pdf",
        "page": 7,
        "sourceType": "exercise",
        "role": "BALANCE sequences",
        "status": "current-context"
      }
    }
  ],
  "codeExercises": []
}
